{
  "@context": [
    "https://www.w3.org/ns/credentials/v2",
    "https://purl.imsglobal.org/spec/ob/v3p0/context.json"
  ],
  "id": "urn:uuid:7c9e6679-7425-40de-944b-e07fc1f90ae7",
  "type": [
    "VerifiableCredential",
    "OpenBadgeCredential"
  ],
  "issuer": {
    "id": "did:youva:issuer:delhi-public-school",
    "name": "Delhi Public School, Sector XII, R.K. Puram",
    "type": "EducationalInstitution"
  },
  "validFrom": "2026-08-30T10:00:00Z",
  "credentialSubject": {
    "id": "did:youva:student:a1b2c3d4e5f67890",
    "type": "AchievementSubject",
    "achievement": {
      "id": "urn:youva:achievement:math-g10-quad-01",
      "name": "Class 10 Quadratic Equations Mastery",
      "description": "Demonstrated full procedural fluency and conceptual understanding of standard quadratic equations, factorisation, discriminant analysis, and word problem modeling.",
      "competencyCode": "MATH-G10-QUAD-01",
      "criteria": "Demonstrated >= 85% Corbett & Anderson BKT mastery on verified CBSE Grade 10 problem bank."
    },
    "verificationTokenHash": "e3b0c44298fc1c149afbf4c8996fb92427ae41e4649b934ca495991b7852b855",
    "evidence": [
      {
        "type": "FormativePracticeEvidence",
        "competency": "MATH-G10-QUAD-01",
        "metrics": {
          "questionsAnswered": 22,
          "timeOnTaskMinutes": 64.5,
          "independentAccuracy": 0.8636,
          "finalBktMastery": 0.892
        }
      }
    ]
  },
  "teacherAuthorization": {
    "teacherId": "TCH-DPS-101",
    "teacherRole": "Senior Mathematics Faculty",
    "decision": "APPROVED",
    "authorizedAt": "2026-08-30T10:00:00Z",
    "signature": "sig_ed25519_deshmukh_88f9104b2c"
  },
  "proof": {
    "type": "HmacSha256Signature2026",
    "created": "2026-08-30T10:00:00Z",
    "verificationMethod": "did:youva:issuer:delhi-public-school#key-1",
    "proofPurpose": "assertionMethod",
    "proofValue": "a67fe99e1986c7b9e73523ba78536cf24fa2be04213ad58b16348873426e25c1"
  }
}
